{
  "$schema": "https://json-schema.org/draft/2020-12/schema",
  "$id": "https://ryoko.invalid/contracts/TranslateRequest.schema.json",
  "title": "TranslateRequest",
  "type": "object",
  "required": [
    "text",
    "from",
    "to"
  ],
  "properties": {
    "text": {
      "type": "string",
      "minLength": 1,
      "maxLength": 500,
      "description": "What you typed, in your language"
    },
    "from": {
      "type": "string",
      "pattern": "^[a-z]{2,3}(-[A-Za-z0-9]{2,8})*$",
      "description": "BCP-47 language tag, e.g. en, ja, zh-Hans"
    },
    "to": {
      "type": "string",
      "pattern": "^[a-z]{2,3}(-[A-Za-z0-9]{2,8})*$",
      "description": "BCP-47 language tag, e.g. en, ja, zh-Hans"
    },
    "situation": {
      "type": "object",
      "required": [
        "mode",
        "localTime",
        "timeZone",
        "hourBucket",
        "place",
        "city",
        "countryCode",
        "localLanguage"
      ],
      "properties": {
        "mode": {
          "type": "string",
          "enum": [
            "live",
            "preview"
          ]
        },
        "localTime": {
          "type": "string",
          "format": "date-time",
          "pattern": "^\\d{4}-\\d{2}-\\d{2}T\\d{2}:\\d{2}(:\\d{2}(\\.\\d+)?)?(Z|[+-]\\d{2}:\\d{2})$",
          "description": "ISO 8601 local time with offset, e.g. 2026-10-05T15:00:00+08:00"
        },
        "timeZone": {
          "type": "string",
          "minLength": 1,
          "description": "IANA time zone, e.g. Asia/Shanghai"
        },
        "hourBucket": {
          "type": "string",
          "pattern": "^\\d{4}-\\d{2}-\\d{2}T\\d{2}$",
          "description": "Local date and hour, e.g. 2026-10-05T15"
        },
        "place": {
          "anyOf": [
            {
              "type": "object",
              "required": [
                "name",
                "category",
                "coordinate"
              ],
              "properties": {
                "id": {
                  "type": "string",
                  "minLength": 1,
                  "description": "MKMapItem.Identifier raw value; absent when MapKit has none"
                },
                "name": {
                  "type": "string",
                  "minLength": 1,
                  "maxLength": 120
                },
                "localName": {
                  "type": "string",
                  "minLength": 1,
                  "maxLength": 120
                },
                "category": {
                  "type": "string",
                  "enum": [
                    "cafe",
                    "tea",
                    "restaurant",
                    "ramen",
                    "bar",
                    "bakery",
                    "convenience_store",
                    "museum",
                    "park",
                    "temple_shrine",
                    "shopping",
                    "transit",
                    "hotel",
                    "other"
                  ],
                  "description": "Category slug from contracts/tables/categories.json"
                },
                "address": {
                  "type": "string",
                  "minLength": 1,
                  "maxLength": 240
                },
                "coordinate": {
                  "type": "object",
                  "required": [
                    "lat",
                    "lon"
                  ],
                  "properties": {
                    "lat": {
                      "type": "number",
                      "minimum": -90,
                      "maximum": 90
                    },
                    "lon": {
                      "type": "number",
                      "minimum": -180,
                      "maximum": 180
                    }
                  },
                  "additionalProperties": false
                }
              },
              "additionalProperties": false
            },
            {
              "type": "null"
            }
          ]
        },
        "city": {
          "type": "string",
          "minLength": 1,
          "maxLength": 80
        },
        "district": {
          "type": "string",
          "minLength": 1,
          "maxLength": 80
        },
        "countryCode": {
          "type": "string",
          "pattern": "^[A-Z]{2}$",
          "description": "ISO 3166-1 alpha-2 country code"
        },
        "localLanguage": {
          "type": "string",
          "pattern": "^[a-z]{2,3}(-[A-Za-z0-9]{2,8})*$",
          "description": "BCP-47 language tag, e.g. en, ja, zh-Hans"
        }
      },
      "additionalProperties": false
    }
  },
  "additionalProperties": false
}
