{
  "text": "Can I have a hot oat latte with less sugar?",
  "from": "en",
  "to": "zh-Hans",
  "situation": {
    "mode": "preview",
    "localTime": "2026-10-05T15:00:00+08:00",
    "timeZone": "Asia/Shanghai",
    "hourBucket": "2026-10-05T15",
    "place": {
      "id": "fixture-shanghai-wutong-coffee",
      "name": "Wutong Coffee",
      "localName": "梧桐咖啡",
      "category": "cafe",
      "address": "118 Yuyuan Road, Jing'an District, Shanghai",
      "coordinate": { "lat": 31.2238, "lon": 121.4412 }
    },
    "city": "Shanghai",
    "district": "Jing'an",
    "countryCode": "CN",
    "localLanguage": "zh-Hans"
  }
}
