{
  "text": "Firm noodles and less oil, please.",
  "from": "en",
  "to": "ja",
  "situation": {
    "mode": "preview",
    "localTime": "2026-10-06T20:00:00+09:00",
    "timeZone": "Asia/Tokyo",
    "hourBucket": "2026-10-06T20",
    "place": {
      "id": "fixture-tokyo-menya-kaze",
      "name": "Menya Kaze",
      "localName": "麺屋 風",
      "category": "ramen",
      "address": "1-12-5 Nishi-Shinjuku, Shinjuku City, Tokyo",
      "coordinate": { "lat": 35.6912, "lon": 139.6978 }
    },
    "city": "Tokyo",
    "district": "Shinjuku",
    "countryCode": "JP",
    "localLanguage": "ja"
  }
}
